{
  "id": "r1m1-repository-and-docs-baseline",
  "type": "milestone",
  "version": 1,
  "created_at": "2026-04-02T00:00:00Z",
  "updated_at": "2026-04-02T12:00:00Z",
  "created_by": "human",
  "session_id": null,
  "status": "satisfied",
  "data": {
    "name": "Repository and Docs Baseline",
    "requirement_id": "r1-prototype-baseline",
    "description": "Deliver root documents, complete docs/ placeholder tree, first requirement-task-workflow example chain, test directory, ESLint, and passing verify scripts.",
    "acceptance_checks": [
      { "id": "ck1", "description": "INDEX.md links to all sub-entries", "checked": true },
      { "id": "ck2", "description": "docs/repository-layout.md matches actual repo structure", "checked": true },
      { "id": "ck3", "description": "t1-step1-baseline.md listed paths complete", "checked": true },
      { "id": "ck4", "description": "npm run build && typecheck && lint pass", "checked": true }
    ],
    "prerequisites": [
      {
        "id": "pre-1",
        "description": "Vite + React + TS scaffold exists",
        "check_type": "automated",
        "check": { "command": "npm run typecheck", "expect_exit_code": 0 },
        "status": "satisfied",
        "last_checked": "2026-04-02T12:00:00Z"
      },
      {
        "id": "pre-2",
        "description": "Build succeeds",
        "check_type": "automated",
        "check": { "command": "npm run build", "expect_exit_code": 0 },
        "status": "satisfied",
        "last_checked": "2026-04-02T12:00:00Z"
      },
      {
        "id": "pre-3",
        "description": "Lint passes",
        "check_type": "automated",
        "check": { "command": "npm run lint", "expect_exit_code": 0 },
        "status": "satisfied",
        "last_checked": "2026-04-02T12:00:00Z"
      }
    ]
  }
}
